{
  "$schema": "./module.schema.json",
  "id": "academy-portal-container-access-manual",
  "title": "Academy portal container access (presentation: Continue)",
  "description": "Review each highlighted console action and press Continue to let the plugin perform and verify it.",
  "completionText": "Presentation complete: the Academy database pod terminal is open.",
  "context": {
    "primaryResource": "academyDatabase",
    "resources": {
      "academyDatabase": {
        "apiVersion": "v1",
        "kind": "Pod",
        "label": "Academy database pod",
        "listPath": "/k8s/ns/dcs-academy-portal/core~v1~Pod",
        "name": "dcs-academy-portal-db-1",
        "namespace": "dcs-academy-portal",
        "consolePath": "/k8s/ns/dcs-academy-portal/pods/dcs-academy-portal-db-1",
        "tabs": {
          "logs": "/k8s/ns/dcs-academy-portal/pods/dcs-academy-portal-db-1/logs",
          "terminal": "/k8s/ns/dcs-academy-portal/pods/dcs-academy-portal-db-1/terminal"
        }
      }
    }
  },
  "steps": [
    {
      "id": "open-workloads",
      "title": "Open Workloads",
      "description": "Workload resources such as Pods are grouped under Workloads. Continue to expand the navigation section.",
      "target": { "type": "quickStartId", "value": "qs-nav-workloads" },
      "complete": {
        "operation": { "type": "activateTarget" },
        "presentation": { "initiator": "continue" },
        "verify": { "type": "targetAttribute", "attribute": "aria-expanded", "value": "true" }
      }
    },
    {
      "id": "open-pods",
      "title": "Open Pods",
      "description": "Pods are running workload instances. Continue to open the project-scoped Pods page.",
      "target": { "type": "href", "value": "/k8s/ns/dcs-academy-portal/core~v1~Pod" },
      "complete": {
        "operation": { "type": "navigate", "path": "/k8s/ns/dcs-academy-portal/core~v1~Pod" },
        "presentation": { "initiator": "continue" },
        "verify": { "type": "route", "path": "/k8s/ns/dcs-academy-portal/core~v1~Pod" }
      }
    },
    {
      "id": "open-pod",
      "title": "Open the Academy database pod",
      "description": "A pod details page brings status, configuration, logs, events, and container access together.",
      "target": { "type": "href", "value": "/k8s/ns/dcs-academy-portal/pods/dcs-academy-portal-db-1" },
      "complete": {
        "operation": { "type": "navigate", "path": "/k8s/ns/dcs-academy-portal/pods/dcs-academy-portal-db-1" },
        "presentation": { "initiator": "continue" },
        "verify": { "type": "route", "path": "/k8s/ns/dcs-academy-portal/pods/dcs-academy-portal-db-1" }
      }
    },
    {
      "id": "open-logs",
      "title": "Inspect the logs",
      "description": "Logs are normally the safest first source of evidence when diagnosing a running workload.",
      "target": { "type": "href", "value": "/k8s/ns/dcs-academy-portal/pods/dcs-academy-portal-db-1/logs" },
      "complete": {
        "operation": { "type": "navigate", "path": "/k8s/ns/dcs-academy-portal/pods/dcs-academy-portal-db-1/logs" },
        "presentation": { "initiator": "continue" },
        "verify": { "type": "route", "path": "/k8s/ns/dcs-academy-portal/pods/dcs-academy-portal-db-1/logs" }
      }
    },
    {
      "id": "open-terminal",
      "title": "Open the container terminal",
      "description": "Terminal opens an interactive session in the selected pod. Use terminal access carefully.",
      "target": { "type": "href", "value": "/k8s/ns/dcs-academy-portal/pods/dcs-academy-portal-db-1/terminal" },
      "complete": {
        "operation": { "type": "navigate", "path": "/k8s/ns/dcs-academy-portal/pods/dcs-academy-portal-db-1/terminal" },
        "presentation": { "initiator": "continue" },
        "verify": { "type": "route", "path": "/k8s/ns/dcs-academy-portal/pods/dcs-academy-portal-db-1/terminal" }
      }
    }
  ]
}
